{"affiliation_id":9867,"energy":32.75,"id":234765,"life":85.25,"name":"Wolverine","powers":[{"damage":5,"energy":1.15,"id":2345,"name":"Bone Claws"},{"damage":-2,"energy":0.55,"id":2346,"name":"Regeneration","passive":true},{"damage":-10,"energy":0,"id":2347,"name":"Adamant skeleton","passive":true}]}